{
 "schema_version": 1,
 "school": "navigation",
 "name": "Navigation and information architecture",
 "research": "docs/lenses/navigation.md",
 "viewpoints": [
  {
   "id": "navigation.you-are-here",
   "claim": "The person can tell where they are: the navigation item for the current page is marked in code and by more than colour, and the page's h1 and title use the words of the link that led there.",
   "source": {
    "author": "U.S. Web Design System (USWDS)",
    "work": "Side navigation component",
    "url": "https://designsystem.digital.gov/components/side-navigation/",
    "quote": "Show the current page. Indicate where a user is within the navigational hierarchy. Use the “active” state to show users which page they have navigated to."
   },
   "evidence": "author",
   "prefers": [
    "aria-current=\"page\" on the link to the current page, in the top nav, side nav and breadcrumb alike",
    "A current-item style that changes weight, underline, border or background, not only hue",
    "The current section marked in the top nav when the page itself sits deeper than the top nav reaches",
    "Link text, h1 and the first part of <title> in the same words ('Pricing' → h1 'Pricing' → 'Pricing – Acme')"
   ],
   "forbids": [
    "A navigation in which the current page looks and is marked exactly like every other link",
    "A nav item 'Resources' that opens a page headed 'Knowledge hub'",
    "One <title> for every page or view of a single-page app"
   ],
   "measure": {
    "kind": "count",
    "what": "On each page reachable from a nav landmark: does exactly one link per nav landmark whose href matches the current URL (or its section) carry aria-current, and does its computed style differ from its siblings in font-weight, text-decoration, border or background (not colour alone)? Following each nav link, after normalising case and whitespace, does the destination h1 equal, contain or sit inside the link text, and does document.title contain the h1?",
    "mustFail": "A 5-item top nav where the link to the current page has the same style and no aria-current; 'Resources' opens a page whose h1 is 'Knowledge hub' and whose title is just 'Acme'.",
    "mustPass": "The same nav with the current item bold, a 3px bottom border and aria-current=\"page\"; 'Resources' opens h1 'Resources' with title 'Resources – Acme'."
   },
   "exceptions": [
    "USWDS allows nav labels to be 'shorter derivatives of page titles': 'Pricing' leading to 'Pricing and plans' passes by containment",
    "The home link usually carries the brand name, not the home page's h1",
    "The 'more than colour' test is uxcli's, carried over from color.never-the-only-signal; USWDS asks only for an active state"
   ],
   "kinds": {
    "marketing": "yes",
    "content": "yes",
    "data": "yes",
    "workspace": "yes",
    "shop": "yes",
    "transaction": "maybe"
   },
   "kindsWhy": "Any UI with persistent navigation; a linear transaction often has no navigation to mark, but its h1 and title still name the step.",
   "agrees": [
    "color.never-the-only-signal",
    "writing.links-describe-their-destination",
    "usability.mindless-clicks-not-fewer-clicks"
   ]
  },
  {
   "id": "navigation.breadcrumbs-only-for-real-hierarchy",
   "claim": "Breadcrumbs belong on pages more than two levels deep in a hierarchy; never on a flat site, never to show steps in a linear flow, and never in place of the primary navigation.",
   "source": {
    "author": "GOV.UK Design System",
    "work": "Breadcrumbs component",
    "url": "https://design-system.service.gov.uk/components/breadcrumbs/",
    "quote": "Do not use the breadcrumbs component on websites with a flat structure, or to show progress through a linear journey or transaction."
   },
   "evidence": "author",
   "prefers": [
    "A trail that starts with the word 'Home' and follows the site's hierarchy, not the user's click history",
    "Breadcrumbs placed at the top of the page, before <main>, so the skip link skips them",
    "Every ancestor a link; the current page last and marked aria-current, or left off",
    "Breadcrumb wording identical to the page titles it points at"
   ],
   "forbids": [
    "Breadcrumbs that list the steps of a sign-up or checkout",
    "'Home > About' on a site whose every page is linked from the top nav",
    "Breadcrumbs as the only way to move between sections",
    "Breadcrumbs and a Back link on the same page"
   ],
   "measure": {
    "kind": "count",
    "what": "If the page has a breadcrumb (a nav whose accessible name contains 'breadcrumb', or an ordered list of links styled as one, before main): does it hold at least two ancestor links (Home > Section > page), does it sit before main, is every item except the current page a link, is there also a primary nav on the page, and is there no Back link and no step indicator on the same page?",
    "mustFail": "A 4-step sign-up shows 'Details > Address > Payment > Confirm' as breadcrumbs above a Continue button.",
    "mustPass": "A guidance page shows 'Home > Driving > Licences' before main, under the site's top nav; the sign-up flow shows a Back link and no breadcrumb."
   },
   "exceptions": [
    "'At least two ancestor links' is uxcli's reading of Carbon's 'more than two levels'; no source gives a link count",
    "GOV.UK ends the trail with the parent section; Primer and USWDS end it with the current page marked aria-current; either passes",
    "USWDS: omit breadcrumbs on the home page and optionally on section landing pages, and where a side navigation already shows the hierarchy",
    "Carbon recognises path-based breadcrumbs (the steps the user took) as a type; GOV.UK and USWDS do not, and this viewpoint follows them"
   ],
   "kinds": {
    "marketing": "maybe",
    "content": "yes",
    "data": "maybe",
    "workspace": "yes",
    "shop": "yes",
    "transaction": "yes"
   },
   "kindsWhy": "Deep content, catalogues and admin trees need breadcrumbs; in transactions the rule applies as a prohibition, and flat marketing sites rarely need them.",
   "agrees": [
    "navigation.back-link-goes-one-step-back"
   ]
  },
  {
   "id": "navigation.back-link-goes-one-step-back",
   "claim": "In a multi-page transaction every page after the first has a Back link at the top, before main, that returns to the previous step with the answers as the user left them; the flow carries no site navigation links or breadcrumbs.",
   "source": {
    "author": "GOV.UK Design System",
    "work": "Back link component",
    "url": "https://design-system.service.gov.uk/components/back-link/",
    "quote": "Make sure the link takes users to the previous page they were on, in the state they last saw it."
   },
   "evidence": "author",
   "prefers": [
    "A link reading 'Back' (or 'Go back to [page]' in complex journeys) above the h1, before <main>",
    "Previous answers still filled in when the user goes back",
    "A Continue button to move forward and a Back link to move back, instead of pagination or tabs",
    "A task list instead of navigation links when the service has one clear end-to-end journey"
   ],
   "forbids": [
    "Relying on the browser Back button, which may lose the user's progress",
    "A Back link that jumps to the start page or the home page",
    "Breadcrumbs, pagination or a site menu used to move between the steps of a form"
   ],
   "measure": {
    "kind": "count",
    "what": "On step n (n ≥ 2) of a flow: is there a link whose text starts with 'Back' or 'Go back' before main? Fill step n−1, continue, then activate that link: is the URL step n−1's, and does every field hold the value entered? Is there no breadcrumb and no pagination on the step?",
    "mustFail": "Step 3 of 4 has no back link; or its Back link goes to the start page and the form there is empty.",
    "mustPass": "Step 3 has 'Back' above the h1; it returns to step 2 with the typed postcode still in the field."
   },
   "exceptions": [
    "The first question page may link back to the service's start page",
    "GOV.UK: where the Back link needs JavaScript and JavaScript is not available, hide it rather than show a broken link",
    "GOV.UK: navigation links suit services used repeatedly, with many tasks and no fixed order; those are not linear flows"
   ],
   "kinds": {
    "marketing": "no",
    "content": "no",
    "data": "no",
    "workspace": "maybe",
    "shop": "maybe",
    "transaction": "yes"
   },
   "kindsWhy": "A rule for multi-page forms: checkout, sign-up, applications and admin wizards; pages without steps have nothing to go back to.",
   "agrees": [
    "usability.clearly-marked-emergency-exit",
    "forms.keep-answers-after-an-error",
    "navigation.breadcrumbs-only-for-real-hierarchy"
   ]
  },
  {
   "id": "navigation.skip-link-is-the-first-tab-stop",
   "claim": "The first Tab press on every page lands on a visible 'Skip to main content' link that moves focus past the header and navigation into main.",
   "source": {
    "author": "GOV.UK Design System",
    "work": "Skip link component",
    "url": "https://design-system.service.gov.uk/components/skip-link/",
    "quote": "Including the skip link component gives users the option to bypass the top-level navigation links and jump to the main content on a page."
   },
   "evidence": "author",
   "prefers": [
    "The skip link immediately after <body> (or after a cookie banner)",
    "Visually hidden until it receives keyboard focus, then clearly shown",
    "A target id on <main> (or its first heading) that can take focus",
    "Breadcrumbs and back links placed before <main>, so the skip link skips them too"
   ],
   "forbids": [
    "A page whose first Tab stop is the logo or the first of a dozen nav links",
    "A skip link that stays invisible when focused",
    "A skip link whose href points at an id that does not exist",
    "A skip link wrapped in <nav> or moved inside the header"
   ],
   "measure": {
    "kind": "count",